{
 "id": "61e18ecb-93ab-4e98-a3c4-e6f9e877cb0e",
 "title": "Autism PCR-free whole genome sequencing data",
 "description": "I am trying to start an autism sequencing project. If you have PCR-free whole genome sequencing data from autism patients, please let me know. Maybe we can collaborate in the future.",
 "user_id": "1a3c7f8d-c97a-4480-932b-68d3c771b8b3",
 "created_at": "2017-04-12T00:23:19.653Z"
}
